{
  "artifact_sha256": "5e5df02350eb6d37edd658e0c87dd590b8c4f65f2b6180a605063d2741a78b28",
  "content_hash": {
    "algorithm": "sha256",
    "value": "78f15eeec07301f49b3c1283d4f8ba42b64f2830be2f24cea6c00ad0a721056f"
  },
  "id": "defactify-text",
  "kind": "prose",
  "labels": {
    "schema": "binary_ai",
    "values": [
      "human (Label_A=0, Label_B=Human_Story)",
      "ai (Label_A=1, Label_B in {Gemma-2-9B, Mistral-7B, Qwen-2-72B, Llama-8B, Yi-Large, GPT-4o})"
    ]
  },
  "license": {
    "citation": "@misc{roy2026comprehensivedatasethumanvs, title={A Comprehensive Dataset for Human vs. AI Generated Text Detection}, author={Rajarshi Roy and Gurpreet Singh and Ashhar Aziz and Shashwat Bajpai and Nasrin Imanpour and Shwetangshu Biswas and Kapil Wanaskar and Parth Patwa and Subhankar Ghosh and Shreyas Dixit and Nilesh Ranjan Pal and Vipula Rawte and Ritvik Garimella and Gaytri Jena and Amitava Das and Amit Sheth and Vasu Sharma and Aishwarya Naresh Reganti and Vinija Jain and Aman Chadha}, year={2026}, eprint={2510.22874}, archivePrefix={arXiv}, primaryClass={cs.CL}}",
    "redistributable": false,
    "spdx": "CC-BY-4.0"
  },
  "limitations": [
    "Domain is New York Times news prose; findings do not transfer automatically to other registers.",
    "Upstream dataset contained API-error artifacts labeled as GPT-4o output; filtered at fetch time (counts in fetch-manifest.json).",
    "AI texts are single-prompt rewrites of the human stories; story groups are reconstructed at load time via TF-IDF near-duplicate clustering.",
    "Dataset repository declares no separate license; the associated paper is CC BY 4.0. We redistribute hashes and fitted parameters only."
  ],
  "notice_entry_required": true,
  "privacy": {
    "contains_pii_risk": "low",
    "raw_text_in_repo": false,
    "sanitization": "hashes-only"
  },
  "schema": "panoptes-dataset-manifest-v1",
  "source": {
    "access": "public",
    "download_instructions": "Run `python -m bench.fetch_defactify`. The script downloads the three parquet splits from Hugging Face, verifies them against pinned SHA-256 hashes, applies documented hygiene filters, and stores clean parquet files under datasets/local/defactify/ (gitignored). Raw text is never committed to this repository.",
    "url": "https://huggingface.co/datasets/Rajarshi-Roy-research/Defactify_Text_Dataset",
    "version": "pinned-sha256 train:9820a98d995f validation:9dc5a986d8ef test:253f8fb9e049"
  },
  "splits": {
    "calibration": {
      "groups": [
        "story (reconstructed at load time via TF-IDF clustering)"
      ],
      "n": 10777
    },
    "group_keys": [
      "story"
    ],
    "test": {
      "groups": [
        "story (reconstructed at load time via TF-IDF clustering)"
      ],
      "n": 10769
    },
    "train": {
      "groups": [
        "story (reconstructed at load time via TF-IDF clustering)"
      ],
      "n": 50120
    }
  },
  "title": "Defactify_Text_Dataset \u2014 NYT human articles vs six LLM families (Roy et al. 2026)"
}
